{
  "tx_id": "a8e1d41d-728c-47c4-89b2-2d087e6e01a4",
  "type": "uk.gov.ons.edc.eq:surveyresponse",
  "version": "0.0.3",
  "origin": "uk.gov.ons.edc.eq",
  "survey_id": "0",
  "flushed": false,
  "submitted_at": "2019-08-20T11:05:44.541979",
  "form_type": "0234",
  "case_type": "B",
  "case_ref": "1000000000000001",
  "channel": "EQ",
  "collection": {
    "exercise_sid": "ae62cb63-be41-4160-8bff-eb2a3bab5c6e",
    "schema_name": "test_relationships",
    "period": "201605",
    "instrument_id": "0123"
  },
  "metadata": {
    "user_id": "UNKNOWN",
    "ru_ref": "74117071486i",
    "display_address": "1 Road, Town City"
  },
  "launch_language_code": "en",
  "submission_language_code": "cy",
  "region_code": "GB-ENG",
  "started_at": "2019-08-20T11:05:25.604330",
  "case_id": "6453e4d3-aac1-424c-be28-23c57aa9e17d",
  "data": {
    "answers": [
      {
        "answer_id": "first-name",
        "value": "John",
        "list_item_id": "zGBdpb"
      },
      {
        "answer_id": "last-name",
        "value": "Doe",
        "list_item_id": "zGBdpb"
      },
      {
        "answer_id": "first-name",
        "value": "Marie",
        "list_item_id": "cWGwcF"
      },
      {
        "answer_id": "last-name",
        "value": "Doe",
        "list_item_id": "cWGwcF"
      },
      {
        "answer_id": "anyone-else",
        "value": "No"
      },
      {
        "answer_id": "number-of-bedrooms-answer",
        "value": 4
      },
      {
        "answer_id": "date-of-birth-answer",
        "value": "1990-01-01",
        "list_item_id": "EINoLs"
      },
      {
        "answer_id": "internet-answer",
        "value": [
          "Broadband or WiFi",
          "A mobile phone network such as 3G, 4G or 5G",
          "Public WiFi hotspot"
        ]
      },
      {
        "answer_id": "business-type-answer",
        "value": "Enter Business type here!",
        "list_item_id": "EINoLs"
      },
      {
        "answer_id": "relationship-answer",
        "value": [
          {
            "list_item_id": "zGBdpb",
            "to_list_item_id": "cWGwcF",
            "relationship": "Husband or Wife"
          },
          {
            "list_item_id": "nEMpwe",
            "to_list_item_id": "adNCSi",
            "relationship": "Son or daughter"
          },
          {
            "list_item_id": "ukGiCK",
            "to_list_item_id": "adNCSi",
            "relationship": "Mother or father"
          }
        ]
      },
      {
        "answer_id": "other-address-uk-answer",
        "value": {
          "line1": "Address Line 1",
          "town": "Town",
          "postcode": "NP10 8XG",
          "uprn": "12345678912"
        },
        "list_item_id": "cWGwcF"
      }
    ],
    "lists": [
      {
        "items": ["zGBdpb", "cWGwcF"],
        "name": "people"
      }
    ]
  }
}
